{
  "schemaVersion": "1.0.0",
  "contractType": "SEM003B3_SIMULATED_PLURALISTIC_EXPERT_REVIEW_RECORD",
  "reviewId": "SEM3B3-SIMULATED-PLURALISTIC-REVIEW-1",
  "recordedAt": "2026-08-13T20:24:00.000Z",
  "roles": [
    {
      "reviewerId": "REVIEWER_SIM_1",
      "role": "SCIENTIFIC_DOMAIN_SPECIALIST",
      "responsibility": "Scientific coherence, REQUIRED, PROHIBITED, OPTIONAL_RELEVANT, plausibility and domain ambiguities."
    },
    {
      "reviewerId": "REVIEWER_SIM_2",
      "role": "METHODOLOGY_AND_OBS_SPECIALIST",
      "responsibility": "Method versus measurement, phenomenon versus observable, timing, comparators, clarification and OBS boundaries."
    },
    {
      "reviewerId": "REVIEWER_SIM_3",
      "role": "SEMANTIC_BENCHMARK_AND_GOVERNANCE_SPECIALIST",
      "responsibility": "Epistemic status, ownership, semantic equivalence, parentage, contamination and SEM-002/SEM-003 governance."
    }
  ],
  "reviewUnits": [
    {
      "caseId": "SEM3-CAL-ATRIAL-FIBROSIS-ABLATION",
      "candidateSet": "CALIBRATION",
      "roleOpinions": [
        {
          "reviewerId": "REVIEWER_SIM_1",
          "disposition": "SIMULATED_ACCEPT",
          "analysis": "The scenario preserves atrial fibrosis, ablation and the deliberately open scientific role without creating an outcome.",
          "reservation": null
        },
        {
          "reviewerId": "REVIEWER_SIM_2",
          "disposition": "SIMULATED_ACCEPT",
          "analysis": "The competing predictive and response-assessment roles remain non-equivalent and require clarification before Project adoption.",
          "reservation": null
        },
        {
          "reviewerId": "REVIEWER_SIM_3",
          "disposition": "SIMULATED_ACCEPT",
          "analysis": "Optional candidates remain non-user facts; parentage assistance reveals no source reuse and blind eligibility stays forbidden.",
          "reservation": null
        }
      ],
      "disagreements": [],
      "consensus": {
        "status": "SIMULATED_EXPERT_CONSENSUS",
        "rationale": "The reference is internally coherent and the unresolved role is intentionally represented rather than completed.",
        "decisions": {
          "SCIENTIFIC_REFERENCE": "SIMULATED_ACCEPT",
          "METHODOLOGICAL_REFERENCE": "SIMULATED_ACCEPT",
          "AMBIGUITY": "SIMULATED_AMBIGUITY_CONFIRMED",
          "PARENTAGE": "SIMULATED_PARENTAGE_CLEAR",
          "CALIBRATION_ADMISSION": "SIMULATED_APPROVE_FOR_CALIBRATION"
        },
        "referenceDisposition": "CALIBRATION_VISIBLE",
        "referenceReviewBasis": "SIMULATED_PLURALISTIC_EXPERT_REVIEW",
        "eligibleForFormalIndependentQualification": false,
        "eligibleForBlindQualification": false,
        "revision": null
      }
    },
    {
      "caseId": "SEM3-CAL-CARDIO-RHYTHM-REMODELING",
      "candidateSet": "CALIBRATION",
      "roleOpinions": [
        {
          "reviewerId": "REVIEWER_SIM_1",
          "disposition": "SIMULATED_ACCEPT",
          "analysis": "Rhythm, structural remodeling and their longitudinal association remain distinct scientific constructs.",
          "reservation": null
        },
        {
          "reviewerId": "REVIEWER_SIM_2",
          "disposition": "SIMULATED_ACCEPT",
          "analysis": "Timing and measurement ownership are preserved without treating a method as the measured phenomenon.",
          "reservation": null
        },
        {
          "reviewerId": "REVIEWER_SIM_3",
          "disposition": "SIMULATED_ACCEPT",
          "analysis": "The envelope forbids causal promotion and Project adoption of contextual candidates; parentage is sufficiently distinct for development calibration.",
          "reservation": null
        }
      ],
      "disagreements": [],
      "consensus": {
        "status": "SIMULATED_EXPERT_CONSENSUS",
        "rationale": "The reference separates phenomenon, observation and association with adequate prohibitions.",
        "decisions": {
          "SCIENTIFIC_REFERENCE": "SIMULATED_ACCEPT",
          "METHODOLOGICAL_REFERENCE": "SIMULATED_ACCEPT",
          "PARENTAGE": "SIMULATED_PARENTAGE_CLEAR",
          "CALIBRATION_ADMISSION": "SIMULATED_APPROVE_FOR_CALIBRATION"
        },
        "referenceDisposition": "CALIBRATION_VISIBLE",
        "referenceReviewBasis": "SIMULATED_PLURALISTIC_EXPERT_REVIEW",
        "eligibleForFormalIndependentQualification": false,
        "eligibleForBlindQualification": false,
        "revision": null
      }
    },
    {
      "caseId": "SEM3-CAL-CONGENITAL-FLOW-ELLIPSIS",
      "candidateSet": "CALIBRATION",
      "roleOpinions": [
        {
          "reviewerId": "REVIEWER_SIM_1",
          "disposition": "SIMULATED_ACCEPT",
          "analysis": "The elliptical continuation remains anchored to congenital flow while the missing anatomical and measurement details stay unknown.",
          "reservation": null
        },
        {
          "reviewerId": "REVIEWER_SIM_2",
          "disposition": "SIMULATED_ACCEPT",
          "analysis": "The reference does not infer a specific observable or acquisition and correctly requests clarification only where decisionally useful.",
          "reservation": null
        },
        {
          "reviewerId": "REVIEWER_SIM_3",
          "disposition": "SIMULATED_ACCEPT",
          "analysis": "Provenance across turns and ownership boundaries remain reconstructible; no Development source is reused.",
          "reservation": null
        }
      ],
      "disagreements": [],
      "consensus": {
        "status": "SIMULATED_EXPERT_CONSENSUS",
        "rationale": "The multi-turn reference is stable because it preserves the ellipse without silently completing it.",
        "decisions": {
          "SCIENTIFIC_REFERENCE": "SIMULATED_ACCEPT",
          "METHODOLOGICAL_REFERENCE": "SIMULATED_ACCEPT",
          "PARENTAGE": "SIMULATED_PARENTAGE_CLEAR",
          "CALIBRATION_ADMISSION": "SIMULATED_APPROVE_FOR_CALIBRATION"
        },
        "referenceDisposition": "CALIBRATION_VISIBLE",
        "referenceReviewBasis": "SIMULATED_PLURALISTIC_EXPERT_REVIEW",
        "eligibleForFormalIndependentQualification": false,
        "eligibleForBlindQualification": false,
        "revision": null
      }
    },
    {
      "caseId": "SEM3-CAL-CORTISOL-SAMPLING-SUMMARY",
      "candidateSet": "CALIBRATION",
      "roleOpinions": [
        {
          "reviewerId": "REVIEWER_SIM_1",
          "disposition": "SIMULATED_ACCEPT",
          "analysis": "The cortisol series and the desire for a quantitative summary are preserved without inventing a biological interpretation.",
          "reservation": null
        },
        {
          "reviewerId": "REVIEWER_SIM_2",
          "disposition": "SIMULATED_ACCEPT",
          "analysis": "Sampling times, summary choice and measurement definition remain separate, with the summary explicitly unresolved.",
          "reservation": null
        },
        {
          "reviewerId": "REVIEWER_SIM_3",
          "disposition": "SIMULATED_ACCEPT",
          "analysis": "Candidate summaries are not promoted to user decisions and the case has no material parentage with visible examples.",
          "reservation": null
        }
      ],
      "disagreements": [],
      "consensus": {
        "status": "SIMULATED_EXPERT_CONSENSUS",
        "rationale": "The reference is suitable for calibration of under-specification and method-versus-measurement handling.",
        "decisions": {
          "SCIENTIFIC_REFERENCE": "SIMULATED_ACCEPT",
          "METHODOLOGICAL_REFERENCE": "SIMULATED_ACCEPT",
          "PARENTAGE": "SIMULATED_PARENTAGE_CLEAR",
          "CALIBRATION_ADMISSION": "SIMULATED_APPROVE_FOR_CALIBRATION"
        },
        "referenceDisposition": "CALIBRATION_VISIBLE",
        "referenceReviewBasis": "SIMULATED_PLURALISTIC_EXPERT_REVIEW",
        "eligibleForFormalIndependentQualification": false,
        "eligibleForBlindQualification": false,
        "revision": null
      }
    },
    {
      "caseId": "SEM3-CAL-MSK-INFLAMMATION-RESPONSE",
      "candidateSet": "CALIBRATION",
      "roleOpinions": [
        {
          "reviewerId": "REVIEWER_SIM_1",
          "disposition": "SIMULATED_ACCEPT",
          "analysis": "Inflammatory response, musculoskeletal context and longitudinal comparison remain explicit without unsupported treatment effect.",
          "reservation": null
        },
        {
          "reviewerId": "REVIEWER_SIM_2",
          "disposition": "SIMULATED_ACCEPT",
          "analysis": "The response construct and candidate observables remain separated; missing operational measures are visible.",
          "reservation": null
        },
        {
          "reviewerId": "REVIEWER_SIM_3",
          "disposition": "SIMULATED_ACCEPT",
          "analysis": "Causal and adoption prohibitions are explicit, while parentage metadata does not indicate derivation.",
          "reservation": null
        }
      ],
      "disagreements": [],
      "consensus": {
        "status": "SIMULATED_EXPERT_CONSENSUS",
        "rationale": "The envelope preserves the scientific response question while preventing unsupported measurement and causal promotion.",
        "decisions": {
          "SCIENTIFIC_REFERENCE": "SIMULATED_ACCEPT",
          "METHODOLOGICAL_REFERENCE": "SIMULATED_ACCEPT",
          "PARENTAGE": "SIMULATED_PARENTAGE_CLEAR",
          "CALIBRATION_ADMISSION": "SIMULATED_APPROVE_FOR_CALIBRATION"
        },
        "referenceDisposition": "CALIBRATION_VISIBLE",
        "referenceReviewBasis": "SIMULATED_PLURALISTIC_EXPERT_REVIEW",
        "eligibleForFormalIndependentQualification": false,
        "eligibleForBlindQualification": false,
        "revision": null
      }
    },
    {
      "caseId": "SEM3-CAL-NEURODEGENERATION-PROGRESSION",
      "candidateSet": "CALIBRATION",
      "roleOpinions": [
        {
          "reviewerId": "REVIEWER_SIM_1",
          "disposition": "SIMULATED_ACCEPT",